title,author,score,ups,downs,url,time created
Actor Danny Trejo saves a trapped baby from an overturned car,Ph_Speed,95572,95572,0,https://www.cnn.com/2019/08/07/entertainment/danny-trejo-saves-baby-trnd/index.html?utm_source=feedburner&utm_medium=feed&utm_campaign=Feed%3A+rss%2Fcnn_latest+%28RSS%3A+CNN+-+Most+Recent%29,1565258567.0
Thousands of Amazon workers demand time off to vote,DonaldWillKillUsAll,95273,95273,0,https://www.nbcnews.com/tech/tech-news/thousands-amazon-workers-demand-time-vote-n1243217,1602652382.0
Calling 911 with a false claim because of race can now put you in prison for years in N.J.,hopopo,94993,94993,0,https://www.nj.com/news/2020/09/calling-911-with-a-false-claim-because-of-a-persons-race-can-now-put-you-in-prison-for-years-in-nj.html,1599015451.0
Measles returned to Costa Rica after five years by French family who had not had vaccinations,vatred,94968,94968,0,https://www.independent.co.uk/news/world/americas/measles-costa-rica-french-tourist-boy-anti-vax-vaccination-who-global-health-threat-infection-mmr-a8794256.html,1551055135.0
Federal judge rules women can get abortion pill without doctor visits,behrkon,94917,94917,0,https://www.pbs.org/newshour/health/federal-judge-rules-women-can-get-abortion-pill-without-doctor-visits,1594709380.0
"Los Angeles Mayor Eric Garcetti, City Officials Cutting $100-$150 Million From LAPD Budget, Funds To Be Reinvested In Communities Of Color",impeccabletim,94768,94768,0,https://deadline.com/2020/06/los-angeles-mayor-eric-garcetti-city-officials-cutting-100-150-million-from-lapd-budget-funds-to-be-reinvested-in-communities-of-color-1202950811/,1591263765.0
Kentucky Sen. Rand Paul tests positive for coronavirus,WagTheKat,94710,94710,0,https://www.courier-journal.com/story/news/local/2020/03/22/kentucky-sen-rand-paul-tests-positive-covid-19/2894959001/,1584928328.0
Mask order issued for entire state of Texas,mresm,94403,94403,0,https://abc13.com/health/mask-order-issued-for-entire-state-of-texas/6292458/,1593750611.0
Buffalo police officers arrested after shoving 75-year-old protester,outerlimtz,94381,94381,0,https://abcnews.go.com/US/buffalo-police-officers-arrested-shoving-75-year-protester/story?id=71106787,1591483973.0
Target joins Walmart in staying closed for Thanksgiving this year,Rogerstonetwitter,94247,94247,0,https://www.cnbc.com/2020/07/27/target-joins-walmart-in-staying-closed-for-thanksgiving-this-year.html,1595885367.0
Larry Nassar sentenced to 175 years in prison in sexual abuse case,OutgoingOrange,94154,94154,0,https://www.usmagazine.com/celebrity-news/news/larry-nassar-sentenced-to-175-years-in-prison-in-sexual-abuse-case/,1516844433.0
Billionaire David Koch dies at age 79,HandSack135,94031,94031,0,https://www.kwch.com/content/news/Billionaire-David-Koch-dies-at-age-79-557984761.html?ref=761,1566592551.0
Woman who lied about being raped on college campus gets jail,chumbucket4urmom,93657,93657,0,http://www.mlive.com/news/bay-city/index.ssf/2018/06/judge_sends_woman_to_jail_for.html,1529460520.0
"Ronna McDaniel, chairwoman of the R.N.C., tests positive for the coronavirus.",amiatthetop3,93524,93524,0,https://www.nytimes.com/live/2020/10/02/us/trump-vs-biden/ronna-mcdaniel-chairwoman-of-the-rnc-tests-positive-for-the-coronavirus,1601675340.0
Steve Bannon indicted in scheme to defraud donors to campaign pledging to build border wall,hoosakiwi,93416,93416,0,https://www.cbsnews.com/news/steve-bannon-indicted-border-wall-fraud-donors/?ftag=CNM-00-10aab7e&linkId=97691530,1597961329.0
Christian Cooper is asking people to stop making death threats against the woman who called the cops on him,TheGamerDanYT,93264,93264,0,https://www.cnn.com/2020/05/27/us/amy-cooper-central-park-call-police-trnd/index.html,1590621207.0
"Elderly couple found dead in apparent murder-suicide, left notes about high medical bills",justsomestubble,92914,92914,0,https://www.nbcnews.com/news/us-news/elderly-couple-found-dead-apparent-murder-suicide-left-notes-about-n1040691,1565384469.0
"Kentucky lawmaker who proposed ""Breonna's Law"" to end no-knock warrants statewide arrested at Louisville protest",Upset-Pumpkin,92689,92689,0,https://www.cbsnews.com/news/breonna-taylor-decision-kentucky-lawmaker-who-proposed-breonnas-law-to-end-no-knock-warrants-arrested-at-louisville-protest/,1601076123.0
Pelosi announces formal impeachment inquiry,Austin63867,92433,92433,0,https://www.rollcall.com/news/congress/pelosi-announces-formal-impeachment-inquiry,1569387922.0
Recreational marijuana becomes legal in Illinois on New Years Day,Berningforchange,92259,92259,0,https://www.reuters.com/article/us-usa-marijuana-illinois/recreational-marijuana-becomes-legal-in-illinois-on-new-years-day-idUSKBN1YS0US?feedType=RSS&feedName=healthNews,1577223130.0
Trump revealed highly classified information to Russian foreign minister and ambassador,onlytounsubscribe,92238,92238,0,http://wapo.st/2pPSCIo,1494911979.0
"Protesters trample, burn LeBron James jerseys in Hong Kong",Bakedschwarzenbach,92216,92216,0,https://www.espn.com/nba/story/_/id/27852132/protesters-trample-burn-lebron-james-jerseys-hong-kong,1571197742.0
"Video shows Minneapolis cop with knee on neck of motionless, moaning man who later died",masktoobig,92181,92181,0,https://www.cbsnews.com/news/video-shows-minneapolis-cop-with-knee-on-neck-of-motionless-moaning-man-he-later-died/,1590520801.0
Comcast fired 500 despite claiming tax cut would create thousands of jobs,rofflemyroffle,92110,92110,0,https://arstechnica.com/tech-policy/2018/01/comcast-fired-500-despite-claiming-tax-cut-would-create-thousands-of-jobs/,1515132767.0
"A suspected big cat poacher has been eaten by lions near the Kruger National Park in South Africa, police say",wrdb2007,91830,91830,0,http://www.bbc.com/news/world-africa-43035474,1518479445.0
Chris Brown detained on suspicion of rape,EmJ1990,91773,91773,0,http://news.sky.com/story/singer-chris-brown-detained-in-paris-on-suspicion-of-rape-11614412,1548184687.0
NASCAR bans Confederate flag from its races and properties,rbevans,91686,91686,0,https://apnews.com/9c334b98452b2c021bcbc98dd5b51841,1591853349.0
"Man with mental illness spent nearly 5 months in jail before body cam video revealed Garfield Heights officers beat, tased and mocked him",CrazyCor,91618,91618,0,https://www.cleveland.com/court-justice/2020/06/mentally-ill-man-spent-nearly-5-months-in-jail-before-body-cam-video-revealed-garfield-heights-officers-beat-tased-and-mocked-him.html,1592350380.0
"Sacha Baron Cohen Crashes Right Wing Event, Leads Absurd Sing-Along",impeccabletim,91503,91503,0,https://deadline.com/2020/06/sacha-baron-cohen-crashes-right-wing-event-leads-singalong-1202972079/,1593393160.0
Comcast deleted net neutrality pledge the same day FCC announced repeal,mixplate,91478,91478,0,https://arstechnica.com/tech-policy/2017/11/comcast-deleted-net-neutrality-pledge-the-same-day-fcc-announced-repeal/,1512011540.0
Senate approves bill to extend 9/11 victims fund,AFlaccoSeagulls,91458,91458,0,https://apnews.com/096173d122bb4e328657d8d75099ae8e?utm_medium=AP&utm_campaign=SocialFlow&utm_source=Twitter,1563940767.0
Amazon workers stage strike on Black Friday,DonnieMostDefinitely,91381,91381,0,https://apnews.com/a4143826834346c196514bb3b025dc80,1575065702.0
Woman who coughed on $35K worth of grocery store food charged with four felonies,CapitalCourse,91168,91168,0,https://www.nbcnews.com/news/us-news/grocery-store-throws-out-35k-worth-food-woman-coughed-twisted-n1169401,1585383641.0
"Nestlé cannot claim bottled water is ‘essential public service’, court rules",boxed_knives,91154,91154,0,https://www.theguardian.com/business/2019/dec/05/nestle-bottled-water-michigan-osceola-private-public,1575574383.0
Prison whistleblower who exposed unsafe conditions in Arizona facility found dead,FirstManLostOnMars,91097,91097,0,https://abcnews.go.com/amp/US/prison-whistleblower-exposed-unsafe-conditions-arizona-facility-found/story?id=69530523,1584044382.0
Campaign to 'thank' Xi Jinping flatly rejected by Wuhan citizens,catshit01,90993,90993,0,https://asia.nikkei.com/Editor-s-Picks/China-up-close/Campaign-to-thank-Xi-Jinping-flatly-rejected-by-Wuhan-citizens,1584216293.0
Hate crime charges filed against 4 in torture of teen,the_human_raincheck,90942,90942,0,http://abc7chicago.com/news/4-charged-with-hate-crimes-in-torture-of-teen-in-facebook-live-video/1687517/,1483670516.0
Jeffrey Epstein Death: 2 Guards Slept Through Checks and Falsified Records,standardtissue,90855,90855,0,https://www.nytimes.com/2019/08/13/nyregion/jeffrey-epstein-jail-officers.html,1565899458.0
Rhino poacher trampled to death by elephant; remains eaten by lions,imagepoem,90804,90804,0,https://www.ajc.com/news/national/rhino-poacher-trampled-death-elephant-remains-eaten-lions/1nzyz9GcAigW6yzy6x2ATL/,1554621076.0
Exclusive: Georgia doctor who forcibly sterilized detained women has been identified,TrillboBaggins,90790,90790,0,https://www.prismreports.org/article/2020/9/15/exclusive-georgia-doctor-who-forcibly-sterilized-detained-women-has-been-identified,1600234157.0
'Epstein Didn’t Kill Himself' Mardi Gras float causes a stir,Horror_Mango,90663,90663,0,https://www.971theriver.com/entertainment/epstein-didn-kill-himself-mardi-gras-float-causes-stir/VuPOD6qEyX3gSLCk7ZsNiO/?fbclid=IwAR1kvlr0x9QjuNqSFW_ZnpBxMmKn6xmOTveCvi_6x1sTEwmYhjnxPa51QP8&utm_source=fark&utm_medium=website&utm_content=link&ICID=ref_fark,1582699725.0
"Louisville Metro Council Agrees To Ban No-Knock Raids. Breonna Taylor was killed nearly three months ago during a no-knock raid. All 26 members of the Metro Council have signed on as co-sponsors to “Breonna’s Law,” which would ban them.",SunOverSnowPlease,90659,90659,0,https://theappeal.org/louisville-kentucky-ban-no-knock-warrants-breonna-taylor/,1591939513.0
"YouTube suspends Logan Paul’s ad revenue, blames ‘recent pattern of behavior",,90463,90463,0,https://www.theverge.com/2018/2/9/16994364/logan-paul-youtube-suspends-advertising,1518209585.0
Michigan becomes the 10th state to legalize recreational marijuana,Slightles_crip,90426,90426,0,https://themarijuanaherald.com/news/michigan-voters-legalize-marijuana/,1541592918.0
"Police officer fired after ""fabricating"" story about being served McDonald's coffee with ""f***ing pig"" written on cup",Hrekires,90429,90429,0,https://www.cbsnews.com/news/mcdonalds-junction-city-controversy-kansas-police-officer-fired-today-for-allegedly-fabricating-claim-2019-12-30/,1577786759.0
"Eddie Van Halen, Guitar Hero, Dies At 65",avivaisme,90382,90382,0,https://www.npr.org/2020/10/06/834995224/eddie-van-halen-guitar-hero-dies-at-65,1602042549.0
Doctor who tweeted that she would give Jews the wrong medication loses ohio medical certificate,Sub2lazarbeamYT,89838,89838,0,https://vosizneias.com/2020/08/24/doctor-who-tweeted-that-she-would-give-jews-the-wrong-medications-loses-ohio-medical-certificate/,1598415250.0
"Terry Crews Testifies Before Senate On Sexual Assault, Says He Won’t Be In ‘Expendables 4’ After Producer Threatened “Trouble”",Bigd1979666,89600,89600,0,https://deadline.com/2018/06/terry-crews-senate-testimony-sexual-assault-expendables-4-threatened-trouble-1202417462/,1530073489.0
New York Times reporter infected with Covid-19 says the White House is not doing contact tracing,Kronickiller125,89546,89546,0,https://www.cnn.com/2020/10/05/media/michael-shear-white-house-journalist/index.html,1601951068.0
Comcast asks the FCC to prohibit states from enforcing net neutrality,cdtoad,89208,89208,0,https://arstechnica.com/tech-policy/2017/11/comcast-asks-the-fcc-to-prohibit-states-from-enforcing-net-neutrality/,1509829515.0
Law Enforcement fires paint projectile at residents on porch during curfew,MrRKipling,89084,89084,0,https://www.fox9.com/news/video-law-enforcement-fires-paint-projectile-at-residents-on-porch-during-curfew,1590967687.0
"Ann Arbor decriminalizes magic mushrooms, psychedelic plants",geoxol,88962,88962,0,https://apnews.com/article/plants-archive-fungi-ann-arbor-b0ce69ca0961c150e0f900e8ea4cf432,1601439546.0
Corey Feldman launches campaign to expose Hollywood pedophile ring,Autisticpepe,88634,88634,0,http://movieweb.com/amp/corey-feldman-truth-campaign-expose-hollywood-pedophile-ring/,1509004475.0
A principal in Florida said he couldn't confirm the Holocaust was a 'factual' event. The school district just fired him,joesoldlegs,88589,88589,0,https://www.cnn.com/2019/10/30/us/florida-principal-holocaust-fired-trnd/index.html,1572513790.0
Michael Cohen sentenced to 3 years in prison,DaramoeX,88297,88297,0,https://www.cbsnews.com/news/michael-cohen-sentencing-in-federal-court-12-12-2018-today-live-updates/,1544663264.0
Facebook fails to convince lawmakers it needs to track your location at all times,hopopo,88193,88193,0,https://www.cnbc.com/2019/12/17/facebook-responds-to-senators-questions-on-location-tracking-policy.html,1576708727.0
CNN's Anthony Bourdain dead at 61,in_michigan,87919,87919,0,http://www.kbzk.com/story/38379046/cnns-anthony-bourdain-dead-at-61,1528485724.0
Marine kicked out of Marine Corps for role in Charlottesville white supremacist march | WTOP,Thefireisrishing,87886,87886,0,https://wtop.com/virginia/2018/08/marine-kicked-out-of-marine-corps-for-role-in-charlottesville-white-supremacist-march/,1533682558.0
Ex-Trump adviser sold $31m in shares days before president announced steel tariffs,snowsnothing,87543,87543,0,https://www.theguardian.com/business/2018/mar/02/carl-icahn-shares-sell-trump-steel-tariffs-announcement-timing,1520042133.0
"Verne Troyer, best known as Mini-Me in ""Austin Powers,"" has died",houshutter,87489,87489,0,http://abc13.com/entertainment/verne-troyer-best-known-as-mini-me-in-austin-powers-has-died/3375895/,1524371756.0
"Cops admit vandalizing cars of man who filed complaint against them, prosecutor says",JerseyWiseguy,87368,87368,0,https://www.nj.com/monmouth/2020/08/cops-admit-vandalizing-cars-of-man-who-filed-complaint-against-them-prosecutor-says.html,1598436061.0
Man who plowed into Charlottesville crowd found guilty,Capt_Kirk10,87171,87171,0,http://www.nbc12.com/2018/12/07/man-who-plowed-into-charlottesville-crowd-found-guilty/,1544249472.0
Stephen Hawking to Be Buried Between Darwin and Newton.,petitveritas,87148,87148,0,https://www.thedailybeast.com/stephen-hawking-to-be-buried-between-darwin-and-newton,1529098318.0
"Publix buys 5 million pounds of produce to support local farmers, donates to food banks",pain_in_your_ass,87042,87042,0,https://www.whio.com/news/trending/publix-buys-5-million-pounds-produce-support-local-farmers-donates-food-banks/KWIZOCW5BJDQHI5FJ23XACW25E/,1594620992.0
Trump withdrawing US from Paris climate agreement,watkinsjoe,87019,87019,0,http://abcnews.go.com/Politics/trump-withdrawing-us-paris-climate-agreement/story?id=47767077,1496375375.0
Grandma and young man she accidentally invited to Thanksgiving are spending their fourth holiday together - CBS News,brstevens,86976,86976,0,https://www.cbsnews.com/news/grandma-and-teen-she-accidentally-invited-to-thanksgiving-are-spending-their-fourth-holiday-together/?fbclid=IwAR2yvdL10ENqhcsO7n_jDXyyQ5T3jX0fsVfYva-FsqVItER6nnlQoRBjr2k#,1574976112.0
President Trump being taken to Walter Reed as a 'precautionary measure',duck-butters,86835,86835,0,https://www.cnbc.com/2020/10/02/president-trump-being-taken-to-walter-reed-military-medical-center-as-a-precautionary-measure.html?__source=androidappshare,1601702408.0
A Navy veteran says he was beaten and pepper sprayed by authorities while attending his first protest in Portland,tugboattomp,86784,86784,0,https://www.cnn.com/2020/07/20/us/portland-protester-navy-veteran-beaten/index.html,1595269978.0
"Nestle has been bottling and selling water it has no right to in drought-stricken California, state says",claire0,86734,86734,0,http://www.independent.co.uk/news/world/americas/nestle-water-selling-diverting-bottled-arrowhead-san-bernardino-forest-california-a8130686.html,1514490526.0
"50,000 net neutrality complaints were excluded from FCC’s repeal docket",Johnny_W94,86644,86644,0,https://arstechnica.com/tech-policy/2017/12/fcc-refused-to-include-50000-net-neutrality-complaints-in-repeal-docket/,1512533719.0
New York City breaks record: 58 straight days with no pedestrian deaths,scott_gc,86591,86591,0,https://abcnews.go.com/US/york-city-breaks-record-58-straight-days-pedestrian/story?id=70654065,1589397335.0
F.B.I. Raids Office of Trump’s Longtime Lawyer Michael Cohen,imomushi8,86481,86481,0,https://www.nytimes.com/2018/04/09/us/politics/fbi-raids-office-of-trumps-longtime-lawyer-michael-cohen.html,1523332846.0
Teen who shared photo of packed high school hallway says she's receiving threats,diffcalculus,86383,86383,0,https://www.cnn.com/2020/08/10/us/paulding-school-crowded-halls-threats/index.html,1597076653.0
California votes to bar schools from starting before 8:30am to help give students more sleep,MrSerious1,86301,86301,0,http://www.foxnews.com/us/2018/09/01/california-votes-to-bar-schools-from-starting-before-8-30am-to-help-give-students-more-sleep.html,1535858290.0
Record 9 million comments flood FCC on net neutrality,PoliticalScienceGrad,86166,86166,0,https://www.usatoday.com/story/tech/news/2017/07/19/record-9-million-comments-flood-fcc-net-neutrality/488042001/,1500752596.0
Black disabled Veteran Sean Worsley sentenced to spend 60 months in Alabama prison for medical marijuana,americanalyss,86154,86154,0,https://www.alreporter.com/2020/07/13/black-disabled-veteran-sentenced-to-spend-60-months-in-prison-for-medical-marijuana/?fbclid=IwAR2425EDEpUaxJScBZsDUZ_EvVhYix46msMpro8JsIGrd6moBkkHnM05lxg,1594692794.0
Swedish DJ Avicii Dead at 28,allzpower,85810,85810,0,https://www.billboard.com/articles/news/dance/8358389/avicii-dead-tim-berglund,1524274100.0
Twitter hides Trump tweet for 'glorifying violence',ani625,85624,85624,0,https://www.bbc.com/news/technology-52846679,1590770719.0
Dr. Anthony Fauci to throw first pitch for Nationals on Opening Day,randy88moss,85436,85436,0,https://www.fox5dc.com/news/dr-anthony-fauci-to-throw-first-pitch-for-nationals-on-opening-day,1595306805.0
Hong Kong protesters form 28-mile human chain demanding democracy,byebyebyecycle,85403,85403,0,https://www.nbcnews.com/news/world/hong-kong-protesters-form-28-mile-human-chain-demanding-democracy-n1045716,1566612770.0
U.S. Postal Service says it will run out of money by September,d3adandbr0k3n,85334,85334,0,https://www.kltv.com/2020/04/10/us-postal-service-says-it-will-run-out-money-by-september/,1586641012.0
Oxygen-dependent man dies 12 minutes after PG&E cuts power to his home,American_potatoe,85324,85324,0,https://www.foxnews.com/us/oxygen-dependent-man-dies-12-minutes-after-pge-cuts-power-to-his-home,1570911805.0
Kaepernick and Fauci will be honored as Robert F. Kennedy Human Rights award laureates,Ravenq222,85205,85205,0,https://www.cnn.com/2020/07/29/us/kennedy-award-fauci-kaepernick-trnd/index.html,1596070128.0
Chicago Police: 4 in custody after young man tortured on Facebook Live,HexezWork,84891,84891,0,http://www.fox32chicago.com/news/crime/227116738-story,1483599867.0
"FBI cannot even look at your phone lock screen without a warrant, rules judge",Majnum,84840,84840,0,https://9to5mac.com/2020/05/22/phone-lock-screen/,1590258649.0
