title,author,score,ups,downs,url,time created
President Donald Trump says he has tested positive for coronavirus,hoosakiwi,227328,227328,0,https://www.cnbc.com/2020/10/02/president-donald-trump-says-he-has-tested-positive-for-coronavirus.html,1601643857.0
Blizzard Employees Staged a Walkout After the Company Banned a Gamer for Pro-Hong Kong Views,SageMo,226337,226337,0,https://www.thedailybeast.com/blizzard-employees-staged-a-walkout-to-protest-banned-pro-hong-kong-gamer,1570682717.0
Kobe Bryant killed in helicopter crash in California,headee,213682,213682,0,https://www.fox5dc.com/news/kobe-bryant-killed-in-helicopter-crash-in-california-tmz-reports,1580096278.0
Scientist Stephen Hawking has died aged 76,areallyshitusername,188177,188177,0,http://news.sky.com/story/scientist-stephen-hawking-has-died-aged-76-11289119,1521027928.0
"Jeffrey Epstein's autopsy more consistent with homicidal strangulation than suicide, Dr. Michael Baden reveals",purrgatory920,186241,186241,0,https://www.foxnews.com/us/forensic-pathologist-jeffrey-epstein-homicide-suicide,1572464847.0
F.C.C. Announces Plan to Repeal Net Neutrality,IAmSlimShady,177994,177994,0,https://www.nytimes.com/2017/11/21/technology/fcc-net-neutrality.html,1511312193.0
Supreme Court rules workers can't be fired for being gay or transgender,schwachs,170555,170555,0,https://www.cnbc.com/2020/06/15/supreme-court-rules-workers-cant-be-fired-for-being-gay-or-transgender.html?__source=iosappshare%7Ccom.apple.UIKit.activity.CopyToPasteboard,1592258847.0
"Jeffrey Epstein, accused sex trafficker, dies by suicide: Officials",headee,170198,170198,0,https://abcnews.go.com/US/jeffrey-epstein-accused-sex-trafficker-dies-suicide-officials/story?id=64881684,1565470855.0
"Ghislane Maxwell, long-time friend and confidante of Jeffrey Epstein, has been arrested by the FBI and charged by federal prosecutors",JeopardyIsASport,164868,164868,0,https://nbcnews.to/38tf3LC,1593724973.0
Report: Stan Lee dead at 95 - Story,cameraman502,155785,155785,0,http://www.fox46charlotte.com/news/report-stan-lee-dead-at-95,1542077284.0
Arizona Senator John McCain has passed away at the age of 81,nmork,154799,154799,0,https://www.abc15.com/news/state/arizona-senator-john-mccain-has-passed-away-at-the-age-of-81,1535271678.0
President Trump has been impeached,oroticacid,154271,154271,0,https://www.cnn.com/politics/live-news/impeachment-inquiry-12-18-2019/index.html,1576749062.0
"Justice Ruth Bader Ginsburg, Champion Of Gender Equality, Dies At 87",Short-fat-sassy,153599,153599,0,https://www.northcountrypublicradio.org/news/npr/100306972/justice-ruth-bader-ginsburg-champion-of-gender-equality-dies-at-87,1600500908.0
Online influencer Jake Paul charged after Scottsdale looting,RallyZona,152042,152042,0,https://www.abc15.com/news/region-northeast-valley/scottsdale/online-influencer-jake-paul-charged-after-scottsdale-looting,1591315050.0
"Apple admits it slows older iPhones, confirming Geekbench report",ErnestGetsElected,149909,149909,0,https://www.cnet.com/news/apple-iphone-6-6s-7-ios-slow-downs-older-iphones-lithium-ion-batteries/#ftag=CAD-09-10aai5b,1513835953.0
"NY Times: Trump paid $750 in US income taxes in 2016, 2017",SerScronzarelli,149162,149162,0,https://apnews.com/article/archive-personal-taxes-donald-trump-f0e2af5f9f99de9d30dc6b9097121188?utm_campaign=SocialFlow&utm_source=Twitter&utm_medium=AP,1601272671.0
Net Neutrality Overturned,DWinsauer,147347,147347,0,https://www.nytimes.com/2017/12/14/technology/net-neutrality-repeal-vote.html,1513304008.0
Dr. Fauci Named Federal Employee of the Year,phx2dtw,145393,145393,0,https://www.fedweek.com/federal-managers-daily-report/dr-fauci-named-federal-employee-of-the-year/,1602383695.0
"GBI arrests father, son for murder of Ahmaud Arbery",No___ImRight,141036,141036,0,https://www.wjcl.com/article/gbi-arrests-father-son-for-murder-of-ahmaud-arbery/32409481,1588925879.0
Wife of officer charged with murder of George Floyd announces she's divorcing him,iSleepUpsideDown,140161,140161,0,https://www.nbcnews.com/news/us-news/wife-officer-charged-murder-george-floyd-announces-she-s-divorcing-n1219276,1590842068.0
Leader of North Carolina lockdown Protest group tests positive for COVID-19,RandomLeavings,136603,136603,0,https://www.wral.com/coronavirus/nc-coronavirus-live-updates-april-27/19073293/,1588036371.0
"Kanye West removed from Illinois Presidential ballot after nearly 2,000 invalid signatures discovered",eternallatake,133729,133729,0,https://www.xxlmag.com/kanye-west-illinois-ballot-invalid-signatures/,1596936098.0
Portland sees peaceful night of protests following withdrawal of federal troops,hildebrand_rarity,129702,129702,0,https://www.theguardian.com/us-news/2020/jul/31/portland-protests-latest-peaceful-night-federal-troops-withdrawal,1596227118.0
Former President George H.W. Bush Dies at 94,quinninin,129152,129152,0,https://www.nbcdfw.com/news/local/Former-President-George-HW-Bush-Dies-184974861.html,1543668883.0
"Illinois’ Top Legal Officer Wants To License Cops, Just Like Doctors, Hairdressers",BKNas,128864,128864,0,https://www.wbez.org/stories/illinois-top-legal-officer-wants-to-license-cops-just-like-doctors-hairdressers/9a8b6505-4283-4975-ad2f-8b653e96da73,1591442010.0
"Underage girl forced to have sex with Prince Andrew, US court document claims",NameReservedForYou,127015,127015,0,https://www.theguardian.com/uk-news/2020/jul/31/underage-girl-forced-to-have-sex-with-prince-andrew-us-court-document-jeffrey-epstein,1596243387.0
Japanese firm gives non-smokers extra six days holiday to compensate for cigarette break,ajstrange1,126714,126714,0,http://www.independent.co.uk/news/world/asia/japanese-firm-piala-inc-tokyo-non-smokers-extra-six-days-holiday-cigarette-break-a8028541.html,1509477637.0
Entire staffs at 3 Sonic locations quit after wages cut to $4/hour plus tips,Annahsbananas,124885,124885,0,https://kutv.com/news/offbeat/entire-staffs-at-3-sonic-locations-quit-after-wages-cut-to-4hour-plus-tips?fbclid=IwAR0gYmpsHEUfb1YPvhKFz9GV9iTMiyPWb1JvqLlw7zHsQJJ3kopbh62f7wo,1551505940.0
#DeleteFacebook Movement Gains Steam After 50 Million Users Have Data Leaked,JoseTwitterFan,124440,124440,0,https://www.thewrap.com/delete-facebook-twitter-cambridge-analytica/,1521536525.0
Chester Bennington of Linkin Park commits suicide,Another-Chance,123951,123951,0,http://wtkr.com/2017/07/20/tmz-report-chester-bennington-of-linkin-park-commits-suicide/,1500603263.0
Fox News publishes digitally altered and misleading images of Seattle demonstrations,crisvincent,123098,123098,0,https://edition.cnn.com/2020/06/13/media/seattle-fox-news-autonomous-zone-protest/index.html,1592100957.0
Harvey Weinstein sentenced to 23 years in prison for sex assault in case that sparked 'MeToo' movement,JAlbert653,122053,122053,0,https://www.cnbc.com/2020/03/11/harvey-weinstein-sentenced-in-prison-for-sex-assault.html,1583967901.0
"Colorado governor signs police accountability bill, ending qualified immunity defense in the state",rishcast,121930,121930,0,https://www.efficientgov.com/legal/articles/colorado-governor-signs-police-accountability-bill-ending-qualified-immunity-defense-in-the-state-7pCy9MlUviwLRX1O/,1592637598.0
Man dies in Arizona after being restrained by police on hot tarmac for six minutes,Smithman,121746,121746,0,https://news.sky.com/story/man-dies-in-arizona-after-being-restrained-by-police-on-hot-tarmac-for-six-minutes-12053541,1598043721.0
U.S. President Donald Trump fired the federal government's top lawyer Sally Yates on Monday after she took the extraordinarily rare step of defying the White House and refused to defend new travel restrictions targeting seven Muslim-majority nations.,hoosakiwi,121535,121535,0,http://www.reuters.com/article/us-usa-trump-immigration-idUSKBN15E1DE,1485861938.0
Police shoot 13-year-old boy with autism several times after mother calls for help,coeliacmccarthy,120126,120126,0,https://www.theguardian.com/us-news/2020/sep/08/linden-cameron-police-shooting-boy-autism-utah,1599613233.0
Gay men have taken over the Proud Boys Twitter hashtag,throwaway190283111,119970,119970,0,https://www.cnn.com/2020/10/04/us/proud-boys-twitter-hashtag-gay-men-trnd/index.html,1601869740.0
Blizzard pulls Blitzchung from Hearthstone tournament over support for Hong Kong protests,V_IR,119969,119969,0,https://www.cnet.com/news/blizzard-removes-blitzchung-from-hearthstone-grand-masters-after-his-public-support-for-hong-kong-protests/,1570569113.0
"Black woman shot and killed after Kentucky police entered her home as she slept, family says",DonnieMostDefinitely,119829,119829,0,https://www.nbcnews.com/news/nbcblk/black-woman-shot-killed-after-kentucky-police-entered-her-home-n1205651,1589355249.0
Supreme Court rules New York prosecutor can get Trump's tax returns,18-24-61-B-17-17-4,119799,119799,0,https://www.nbcnews.com/politics/supreme-court/supreme-court-rules-new-york-prosecutor-can-get-trump-s-n1232086,1594332979.0
Marine Corps Bans Public Display of Confederate Flag,,119481,119481,0,https://www.nytimes.com/2020/04/23/us/marine-corps-confederate-flag.html,1587795628.0
Judge orders U.S. Postal Service to treat all election mail as 1st class or priority | CBC News,GlitchedGamer14,119378,119378,0,https://www.cbc.ca/news/world/usps-election-mail-1.5732632,1600749817.0
Donald Trump calls for delay to 2020 US presidential election,ani625,119137,119137,0,https://www.bbc.com/news/world-us-canada-53597975,1596143690.0
"U.S. Supreme Court lets Flint, Michigan residents sue over water contamination",protekt0r,119141,119141,0,https://www.reuters.com/article/us-usa-court-flint-idUSKBN1ZK1S5,1579649608.0
"Fired Wilmington cop: “We are just going to go out and start slaughtering them f—— ni—–. I can’t wait. God, I can’t wait.”",hostilecarrot,118509,118509,0,https://portcitydaily.com/local-news/2020/06/24/fired-wilmington-cop-we-are-just-going-to-go-out-and-start-slaughtering-them-f-ni-i-cant-wait-god-i-cant-wait-free-read/?fbclid=IwAR2rQ5D5Fyq6qgTRpdU6clh8a_7iOY_AUDe76SvfMAxywUnUPZVnoGzVVgM,1593063934.0
"Nike, Amazon, Apple, Abercrombie among those using Uyghur Muslims Forced Labor in China",NoMad435,118512,118512,0,https://www.sundayguardianlive.com/news/global-brands-employ-uyghur-muslims-forced-labour,1594683837.0
Italy bans unvaccinated children from school,Crankyoldhobo,118493,118493,0,https://www.bbc.co.uk/news/world-europe-47536981,1552416451.0
'Black Panther' actor Chadwick Boseman dies at 43 after 4-year fight with colon cancer,pfloyd102,118337,118337,0,https://apnews.com/7e2cb43ba86130d92e2128d907b860fd,1598695736.0
Arresting officer in George Floyd case taken into custody by BCA,Minneapolis_W,117848,117848,0,https://kstp.com/news/arresting-officer-derek-chauvin-taken-into-custody-by-bca-george-floyd-case/5743589/?cat=1,1590801414.0
Assaulting a worker who's enforcing masks is now a felony under a new Illinois law,hildebrand_rarity,117372,117372,0,https://www.cnn.com/2020/08/10/us/assault-workers-mask-law-illinois-trnd/index.html,1597097646.0
Dr. Fauci says his daughters need security as family continues to get death threats,Upset-Pumpkin,116798,116798,0,https://www.cnbc.com/2020/08/05/dr-fauci-says-his-daughters-need-security-as-family-continues-to-get-death-threats.html,1596680476.0
Comcast quietly drops promise not to charge tolls for Internet fast lanes,newnemo,116776,116776,0,https://arstechnica.com/tech-policy/2017/11/comcast-quietly-drops-promise-not-to-charge-tolls-for-internet-fast-lanes/,1511833114.0
Hospitals will have to post prices online starting January 1,PsychSiren,116626,116626,0,http://www.fox5dc.com/health/hospitals-will-have-to-post-prices-online-starting-january-1,1545912947.0
Bill Cosby found guilty on all sex assault charges,BabyMonkeyOnPig,116506,116506,0,http://abc7chicago.com/jury-reaches-verdict-in-bill-cosby-sex-assault-retrial/3394442/,1524793869.0
"Grant Imahara, 'Mythbusters' co-host, dead at 49",ani625,116466,116466,0,https://www.abc10.com/article/news/nation-world/grant-imahra-mythbusters-obit/507-82ddb2c7-5583-4334-b4de-6146043f2d12,1594732452.0
Texas Roadhouse CEO forgoes salary and bonus to pay front-line restaurant employees,ALotofThought,115113,115113,0,https://www.chron.com/news/article/Texas-Roadhouse-CEO-forgoes-salary-and-bonus-to-15159380.php?cmpid=hpctp,1585284463.0
Landlord changes locks on California church after pastor said he'd continue to hold services,treetyoselfcarol,114967,114967,0,https://www.ktvu.com/news/landlord-changes-locks-on-california-church-after-pastor-said-hed-continue-to-hold-services,1586290749.0
Woman Is Fired After Calling Police on Black Man in Central Park,DragonPup,114776,114776,0,https://www.nytimes.com/2020/05/26/nyregion/amy-cooper-dog-central-park.html,1590548935.0
"Reddit, Acting Against Hate Speech, Bans ‘The_Donald’ Subreddit",Austin63867,114729,114729,0,https://www.nytimes.com/2020/06/29/technology/reddit-hate-speech.html#click=https://t.co/ouYN3bQxUr,1593480335.0
Officer accused of pushing teen during protest has 71 use of force cases on file,brotogeris1,114203,114203,0,https://www.local10.com/news/local/2020/06/03/officer-accused-of-pushing-teen-during-protest-has-71-use-of-force-cases-on-file/,1591232701.0
GRAPHIC VIDEO: Buffalo police officers violently shove man onto ground,itsajaguar,113296,113296,0,https://news.wbfo.org/post/graphic-video-buffalo-police-officers-violently-shove-man-ground,1591351987.0
"'I can't breathe,' Oklahoma man tells police before dying. 'I don't care,' officer responds.",hildebrand_rarity,112045,112045,0,https://www.nbcnews.com/news/us-news/i-can-t-breathe-oklahoma-man-tells-police-dying-i-n1229586,1591866027.0
82-year-old Houston-area man left without heart medicine for a week due to USPS delays,hildebrand_rarity,112021,112021,0,http://cbsaustin.com/news/local/82-year-old-houston-area-man-left-without-heart-medicine-for-a-week-due-to-usps-delays,1597703169.0
"Amazon blocks sale of merchandise with ""stand back"" and ""stand by""",AudibleNod,111848,111848,0,https://www.cbsnews.com/news/stand-back-and-stand-by-proud-boys-merchandise-amazon/,1601586223.0
"Judge rules to unseal documents in 2015 case against Ghislaine Maxwell, Jeffrey Epstein's alleged accomplice",gulabjamunyaar,111770,111770,0,https://www.cnn.com/2020/07/23/us/ghislaine-maxwell-jeffrey-epstein/index.html,1595551075.0
"Nearly 200,000 people have signed a petition to have Logan Paul kicked off YouTube after controversy over his filming of a dead body in Japan's 'Suicide Forest'",BadDrvrsofSac,111602,111602,0,http://www.thisisinsider.com/logan-paul-change-org-petition-removed-from-youtube-2018-1,1515211931.0
Japanese police want to question Logan Paul,BreakingGarrick,110658,110658,0,https://pagesix.com/2018/01/04/japanese-police-want-to-question-logan-paul/?utm_campaign=SocialFlow&utm_source=P6Twitter&utm_medium=SocialFlow,1515309063.0
James Comey terminated as Director of FBI,JewishDoggy,110066,110066,0,http://abcn.ws/2qPcnnU,1494395360.0
52% of young adults in the US are living with their parents. That's the highest share since the Great Depression,TheGamerDanYT,109785,109785,0,https://www.cnn.com/2020/09/04/us/children-living-with-parents-pandemic-pew/index.html,1599303818.0
Police warn they may use live ammo on protesters in Hong Kong,AnonymousJoe12871245,109629,109629,0,https://news.rthk.hk/rthk/en/component/k2/1492830-20191118.htm,1574038509.0
Bernie Sanders drops out of the presidential race,BabyJesusFTW,108703,108703,0,https://www.cnbc.com/2020/04/08/bernie-sanders-drops-out-of-2020-democratic-presidential-primary.html,1586388282.0
"Hurricane Laura removed a Lake Charles Confederate monument, after parish officials voted to keep it",FatVegain,108623,108623,0,https://www.theadvertiser.com/story/news/2020/08/27/hurricane-laura-takes-down-lake-charles-confederate-monument/5643982002/,1598573018.0
"American Icon and Playboy Founder, Hugh M. Hefner, Has Died",Nearot,108358,108358,0,http://www.prnewswire.com/news-releases/american-icon-and-playboy-founder-hugh-m-hefner-has-died-300527267.html,1506596844.0
"The teacher who disarmed, then hugged a student will receive the citizen Congressional Medal of Honor",hildebrand_rarity,108182,108182,0,https://www.cnn.com/2020/03/31/us/teacher-disarmed-gunman-medal-of-honor-trnd/index.html,1585690706.0
'Pharma bro' Martin Shkreli sentenced to 7 years in prison,BabyJesusFTW,108118,108118,0,https://www.cnbc.com/2018/03/09/pharma-bro-martin-shkreli-sentenced-to-7-years-in-prison.html,1520650650.0
All former officers involved in George Floyd's death are now in custody,xDaze,107896,107896,0,https://edition.cnn.com/us/live-news/george-floyd-protests-06-03-20/h_06080fc14db14acacf12d89c4d953801,1591253908.0
"Thailand cave rescue: All 12 boys, coach freed, latest updates",hazysummersky,107844,107844,0,https://www.dailytelegraph.com.au/news/world/watch-live-thailand-cave-rescue-final-five-boys-and-their-soccer-coach-to-be-freed/news-story/a176bfe7b4ed0a4ed944b986a26f2b3b?nk=1f561b8e18dbcc5f28279deb61b3d1d1-1531222949,1531251898.0
"Fauci says ""serious threats"" have been made against him and his wife and daughters",itsajaguar,107629,107629,0,https://www.cbsnews.com/news/fauci-threats-wife-daughters-family/?ftag=CNM-00-10aab7e&linkId=94959066,1595642058.0
Supreme Court legalizes gay marriage,Peter_Venkman_1,107603,107603,0,http://www.washingtonpost.com/politics/gay-marriage-and-other-major-rulings-at-the-supreme-court/2015/06/25/ef75a120-1b6d-11e5-bd7f-4611a60dd8e5_story.html?tid=sm_tw,1435356168.0
"Thousands of Seattle students told to get vaccinated, or don’t come back after winter break",tugboattomp,107566,107566,0,https://www.kiro7.com/news/local/thousands-seattle-students-told-get-vaccinated-or-dont-come-back-after-winter-break/SRPTUMTXQNBOXHFMRGQ6IB2H4E/,1577583774.0
Kim Jong Un Allegedly in a 'vegetative state' after heart surgery - Japanese Media,TheDefectiveSnoo,107312,107312,0,https://www.jpost.com/international/china-sent-team-with-medical-experts-to-advise-on-nkoreas-kim-625831,1587843265.0
"Pet Store Bill Passes California Senate 38 to 0. It bans the sale of dogs, cats and rabbits sourced from high-volume, commercial breeding facilities, known as mills, in all pet shops throughout the state.",JMyers666,107256,107256,0,https://lbpost.com/life/pets/2000011459-pet-store-bill-passes-california-senate-38-to-0,1505352365.0
Arrest warrant issued for Tampa megachurch pastor who led packed services despite safer-at-home orders,jigsawmap,106107,106107,0,https://www.fox13news.com/news/arrest-warrant-issued-for-tampa-megachurch-pastor-who-led-packed-services-despite-safer-at-home-orders,1585619149.0
George Floyd's family says four officers involved in his death should be charged with murder,-Ph03niX-,105856,105856,0,https://www.cnn.com/2020/05/27/us/minneapolis-george-floyd-police-death/index.html,1590601324.0
"Families of Sandy Hook shooting victims win legal victory in lawsuit against InfoWars, Alex Jones",DragonPup,105786,105786,0,https://abcnews.go.com/beta-story-container/US/families-sandy-hook-shooting-victims-win-legal-victory/story?id=60314174,1547266608.0
Judge denies bail for Ghislaine Maxwell after she pleads not guilty in Jefferey Epstein sex crimes case,Nelsaroni,104967,104967,0,https://www.cnbc.com/2020/07/14/jeffrey-epstein-case-ghislaine-maxwell-sex-crimes-bail-ruling.html,1594782985.0
Breonna Taylor evidence photos contradict LMPD's 'no body cam' claim,CapitalCourse,104914,104914,0,https://www.lex18.com/news/covering-kentucky/breonna-taylor-evidence-photos-contradict-lmpds-no-body-cam-claim,1599641579.0
"Days after photos of packed hallways go viral, Paulding County High School in Georgia reports 9 COVID-19 cases",borboforbo,104794,104794,0,https://www.wsbtv.com/news/local/paulding-county/days-after-photos-packed-hallways-go-viral-paulding-school-reports-9-covid-19-cases/X3FEDBYQ3FEA3F3TX5MMQD6E3Y,1596964248.0
Black armed protesters march in Kentucky demanding justice for Breonna Taylor,nixhex311,103368,103368,0,https://www.reuters.com/article/us-global-race-protests-louisville-idUSKCN24R025,1595798879.0
"Bond denied for father, son charged with murder in Ahmaud Arbery case",yeoxnuuq,103112,103112,0,https://www.wtoc.com/2020/05/08/father-son-charged-with-murder-arbery-case-make-first-court-appearance/?fbclid=IwAR3mEKldj95iiIXSaKKBrxeWtrJK3N_7luG1lMH3z-CAZGR9jFiC6ugXgRg,1588995719.0
Twenty-Two Attorneys General Sue The FCC Over Net Neutrality Repeal,Khaleeasi24,102968,102968,0,https://psmag.com/news/22-attorneys-general-sue-fcc-over-net-neutrality-repeal,1516186033.0
CNN banned from White House press briefing,Pancakejoe1,102364,102364,0,http://money.cnn.com/2017/02/24/media/cnn-blocked-white-house-gaggle/index.html,1487994688.0
Commonwealth’s Attorney: Man who drove through group of protesters is leader of KKK,CmdretteZircon,102155,102155,0,https://www.nbc12.com/2020/06/08/commonwealths-attorney-man-who-drove-through-group-protesters-is-leader-kkk/?fbclid=IwAR0P034jKi0W40gxzwZuXtyLTrxuPFg7hwFEYGdXs0P6kL4HDjvZIV4goZ4,1591665522.0
Kanye West's Yeezy got millions in federal small business loans,Balls_of_Adamanthium,102128,102128,0,https://www.cbsnews.com/news/kanye-west-yeezy-brand-ppp-loans/,1594097318.0
Hospitals Sued to Keep Prices Secret. They Lost.,thewrongun,101797,101797,0,https://www.nytimes.com/2020/06/23/upshot/hospitals-lost-price-transparency-lawsuit.html,1593034572.0
Boy who suffered up to 100 seizures a day has none in 300 days after being prescribed cannabis oil,,101674,101674,0,https://www.independent.co.uk/news/uk/home-news/billy-caldwell-cannabis-oil-boy-seizures-stopped-cured-prescription-medical-marijuana-a7933066.html,1504838867.0
"Texas judge interrupts jury, says God told him defendant is not guilty",HumanChicken,101592,101592,0,http://www.statesman.com/news/crime--law/texas-judge-interrupts-jury-says-god-told-him-defendant-not-guilty/ZRdGbT7xPu7lc6kMMPeWKL/,1516417974.0
Vermont has officially legalized cannabis,mikedomert,101390,101390,0,https://www.google.fi/amp/s/www.forbes.com/sites/tomangell/2018/01/22/vermont-governor-signs-marijuana-legalization-into-law/amp/,1516677866.0
Apple fined for slowing down old iphones.,s1s1s1s,101140,101140,0,https://www.bbc.co.uk/news/technology-51413724,1581130130.0
YouTube star Daddyofive loses custody of two children featured in 'prank' video.,OMFGFlorida,100905,100905,0,http://www.independent.co.uk/life-style/gadgets-and-tech/news/youtube-daddyofive-cody-videos-watch-children-custody-latest-prank-parents-a7713376.html,1493758889.0
Family sues after 26-year-old EMT is shot and killed by police in her own home,bhaggith,100244,100244,0,https://www.cbsnews.com/news/breonna-taylor-family-sues-wrongful-death-killed-police-louisville/,1589573504.0
U.S. court: Mass surveillance program exposed by Snowden was illegal,mobile_website_25323,100023,100023,0,https://www.reuters.com/article/us-usa-nsa-spying/u-s-court-mass-surveillance-program-exposed-by-snowden-was-illegal-idUSKBN25T3CK,1599129201.0
New York Gov. Cuomo signs executive order that allows store owners the right to ban any customer that enters without wearing a mask.,SunOverSnowPlease,99612,99612,0,https://hudsonvalleypost.com/new-york-stores-can-ban-customers-if-not-wearing-masks/,1590710610.0
Carrie Fisher Dies at 60,Spin_Me,99282,99282,0,http://people.com/movies/carrie-fisher-dies/,1482889946.0
Vermont Senate legalizes recreational pot,DrScientist812,99272,99272,0,https://www.usatoday.com/videos/news/nation/2018/01/11/vermont-senate-legalizes-recreational-pot/109341696/,1515710622.0
CNN sues President Trump and White House for banning reporter Jim Acosta,lStrakle,98338,98338,0,https://www.cnbc.com/2018/11/13/cnn-sues-president-trump-and-white-house-for-banning-reporter-jim-acosta.html,1542147949.0
Alex Jones arrested for DWI in Travis County,Austin63867,98158,98158,0,https://cbsaustin.com/news/local/alex-jones-arrested-for-dwi-in-travis-county,1583895331.0
Admitted KKK leader who drove through crowd of protesters found guilty on multiple charges,ety3rd,97969,97969,0,https://www.nbc12.com/2020/08/10/admitted-kkk-leader-who-drove-through-crowd-protesters-found-guilty-multiple-charges/,1597119102.0
"Bob Murray, Who Fought Against Black Lung Regulations As A Coal Operator, Has Filed For Black Lung Benefits",ghostofwiglaf,97863,97863,0,https://www.wvpublic.org/energy-environment/2020-09-30/bob-murray-who-fought-against-black-lung-regulations-as-a-coal-operator-has-filed-for-black-lung-benefits,1601539576.0
Belgium declares loot boxes gambling and therefore illegal,Nahid145,97511,97511,0,https://www.eurogamer.net/amp/2018-04-25-now-belgium-declares-loot-boxes-gambling-and-therefore-illegal,1524710050.0
Bloomberg drops out of 2020 presidential race after poor Super Tuesday showing,BabyJesusFTW,97100,97100,0,https://www.cnbc.com/2020/03/04/mike-bloomberg-drops-out-of-2020-presidential-race.html,1583363609.0
"Thirteen Russians criminally charged for interfering in US election, Mueller announces",fangrider99,97053,97053,0,https://www.theguardian.com/us-news/2018/feb/16/robert-mueller-russians-charged-election?CMP=Share_AndroidApp_reddit_is_fun,1518833901.0
"""Nobody Died at Sandy Hook"" author must pay victim's dad $450,000, jury says",Human02211979,96465,96465,0,https://www.cbsnews.com/news/sandy-hook-defamation-case-conspiracy-theorist-must-pay-father-victim-noah-pozner-450000-wisconsin-jury-says/,1571265136.0
Black gun owners plan pro-Second Amendment walk,Vedder93,96126,96126,0,https://oklahoman.com/article/5664920/black-gun-owners-plan-pro-second-amendment-walk,1592606995.0
Student suspended after showing fellow students without masks,NewsProducer12345,95637,95637,0,https://www.goodmorningamerica.com/news/video/student-suspended-showing-fellow-students-masks-72209309,1596750215.0
